{
  "$schema": "https://json-schema.org/draft/2020-12/schema",
  "title": "3Decks extension manifest — API 1",
  "description": "Structural authoring schema. The host additionally validates uniqueness, defaults, bounds and entrypoint existence.",
  "type": "object",
  "required": ["api_version", "id", "version", "name", "description", "author"],
  "properties": {
    "api_version": { "const": 1, "type": "integer" },
    "id": { "type": "string", "pattern": "^[a-z][a-z0-9.-]{2,47}$" },
    "version": {
      "type": "string",
      "pattern": "^[0-9]+\\.[0-9]+\\.[0-9]+(-[a-zA-Z0-9.-]+)?$"
    },
    "name": { "$ref": "#/$defs/shortText" },
    "description": { "$ref": "#/$defs/text" },
    "author": { "type": "string", "minLength": 1, "maxLength": 100 },
    "runtime": { "enum": ["python", "command"], "default": "python" },
    "entrypoint": { "type": "string", "minLength": 1, "default": "main.py" },
    "command": {
      "type": "array",
      "minItems": 1,
      "maxItems": 16,
      "items": { "type": "string", "minLength": 1, "maxLength": 512 }
    },
    "platforms": {
      "type": "array",
      "minItems": 1,
      "items": { "enum": ["darwin", "win32", "linux"] }
    },
    "permissions": {
      "type": "array",
      "items": { "enum": ["network", "filesystem", "system", "notifications"] }
    },
    "poll_interval": {
      "type": "number",
      "minimum": 0.5,
      "maximum": 60,
      "default": 2
    },
    "settings": { "$ref": "#/$defs/fields" },
    "actions": {
      "type": "array",
      "maxItems": 32,
      "items": { "$ref": "#/$defs/action" }
    },
    "sources": {
      "type": "array",
      "maxItems": 8,
      "items": { "$ref": "#/$defs/contribution" }
    },
    "dashboards": {
      "type": "array",
      "maxItems": 8,
      "items": { "$ref": "#/$defs/contribution" }
    }
  },
  "allOf": [
    {
      "if": {
        "properties": { "runtime": { "const": "command" } },
        "required": ["runtime"]
      },
      "then": { "required": ["command"] }
    }
  ],
  "$defs": {
    "key": { "type": "string", "pattern": "^[a-z][a-z0-9_-]{0,31}$" },
    "text": {
      "oneOf": [
        { "type": "string", "minLength": 1, "maxLength": 300 },
        {
          "type": "object",
          "required": ["en"],
          "properties": {
            "en": { "type": "string", "minLength": 1, "maxLength": 300 },
            "fr": { "type": "string", "minLength": 1, "maxLength": 300 }
          }
        }
      ]
    },
    "shortText": {
      "oneOf": [
        { "type": "string", "minLength": 1, "maxLength": 64 },
        {
          "type": "object",
          "required": ["en"],
          "properties": {
            "en": { "type": "string", "minLength": 1, "maxLength": 64 },
            "fr": { "type": "string", "minLength": 1, "maxLength": 64 }
          }
        }
      ]
    },
    "fields": {
      "type": "array",
      "maxItems": 16,
      "items": { "$ref": "#/$defs/field" }
    },
    "field": {
      "type": "object",
      "required": ["name"],
      "properties": {
        "name": { "$ref": "#/$defs/key" },
        "label": { "$ref": "#/$defs/text" },
        "description": { "$ref": "#/$defs/text" },
        "type": {
          "enum": ["text", "password", "number", "boolean", "select"],
          "default": "text"
        },
        "required": { "type": "boolean", "default": false },
        "default": { "type": ["string", "number", "boolean"] },
        "min": { "type": "number" },
        "max": { "type": "number" },
        "choices": {
          "type": "array",
          "minItems": 1,
          "maxItems": 32,
          "items": {
            "type": "object",
            "required": ["value"],
            "properties": {
              "value": { "type": "string", "minLength": 1, "maxLength": 64 },
              "label": { "$ref": "#/$defs/text" }
            }
          }
        }
      },
      "allOf": [
        {
          "if": {
            "properties": { "type": { "const": "select" } },
            "required": ["type"]
          },
          "then": { "required": ["choices"] }
        },
        {
          "if": {
            "properties": { "type": { "const": "password" } },
            "required": ["type"]
          },
          "then": { "not": { "required": ["default"] } }
        }
      ]
    },
    "contribution": {
      "type": "object",
      "required": ["id", "title"],
      "properties": {
        "id": { "$ref": "#/$defs/key" },
        "title": { "$ref": "#/$defs/shortText" },
        "description": { "$ref": "#/$defs/text" },
        "icon": { "type": "string", "maxLength": 16, "default": "app" },
        "color": {
          "type": "string",
          "pattern": "^#[0-9a-fA-F]{6}$",
          "default": "#66CB10"
        }
      }
    },
    "action": {
      "allOf": [
        { "$ref": "#/$defs/contribution" },
        {
          "type": "object",
          "properties": {
            "arguments": { "$ref": "#/$defs/fields" },
            "state": { "$ref": "#/$defs/key" }
          }
        }
      ]
    }
  }
}
